{
  "$schema": "https://json-schema.org/draft/2020-12/schema",
  "$id": "https://github.com/alirezasafaei-dev/awesome-free-llm-apis-ir/schema/provider.schema.json",
  "title": "Free LLM API provider",
  "type": "object",
  "additionalProperties": false,
  "required": [
    "schema_version",
    "service_type",
    "id",
    "name",
    "website",
    "docs",
    "api",
    "capabilities",
    "free_tier",
    "iran_access",
    "verification",
    "sources"
  ],
  "properties": {
    "schema_version": { "enum": ["1.1.0", "1.2.0"] },
    "service_type": { "enum": ["official_provider", "official_gateway", "community_gateway", "managed_model_hosting", "integrated_inference", "session_bridge", "self_hosted"] },
    "id": { "type": "string", "pattern": "^[a-z0-9]+(?:-[a-z0-9]+)*$" },
    "name": { "type": "string", "minLength": 2 },
    "website": { "type": "string", "format": "uri" },
    "docs": { "type": "string", "format": "uri" },
    "signup": { "type": ["string", "null"], "format": "uri" },
    "signup_requirements": {
      "type": "array",
      "uniqueItems": true,
      "items": { "enum": ["foreign_mobile_number", "identity_verification", "account_activation"] }
    },
    "api": {
      "type": "object",
      "additionalProperties": false,
      "required": ["base_url", "openai_compatible", "auth"],
      "properties": {
        "base_url": { "type": "string", "format": "uri" },
        "openai_compatible": { "type": "boolean" },
        "auth": { "enum": ["api_key", "oauth", "token", "account_id_and_token", "none_or_api_key", "other"] }
      }
    },
    "capabilities": {
      "type": "array",
      "minItems": 1,
      "uniqueItems": true,
      "items": { "enum": ["chat", "text_generation", "reasoning", "embeddings", "tool_calling", "structured_output", "image_generation", "json_mode"] }
    },
    "free_tier": {
      "type": "object",
      "additionalProperties": false,
      "required": ["status", "type", "requires_payment_method", "limits", "notes_fa"],
      "properties": {
        "status": { "enum": ["active", "limited", "trial", "none", "unknown"] },
        "type": { "enum": ["permanent_allowance", "free_models", "monthly_credit", "recurring_credit", "community_funded", "one_time_credit", "time_limited_credit", "conditional_program", "host_your_own_compute_credit", "trial", "unknown"] },
        "requires_payment_method": { "type": ["boolean", "null"] },
        "limits": {
          "type": "array",
          "items": {
            "type": "object",
            "additionalProperties": false,
            "required": ["scope"],
            "properties": {
              "scope": { "type": "string" },
              "model": { "type": ["string", "null"] },
              "condition": { "type": ["string", "null"] },
              "rpm": { "type": ["number", "null"], "minimum": 0 },
              "rpd": { "type": ["number", "null"], "minimum": 0 },
              "rph": { "type": ["number", "null"], "minimum": 0 },
              "tpm": { "type": ["number", "null"], "minimum": 0 },
              "tph": { "type": ["number", "null"], "minimum": 0 },
              "tpd": { "type": ["number", "null"], "minimum": 0 },
              "input_tokens": { "type": ["number", "null"], "minimum": 0 },
              "output_tokens": { "type": ["number", "null"], "minimum": 0 },
              "concurrent_requests": { "type": ["number", "null"], "minimum": 0 },
              "daily_units": { "type": ["number", "null"], "minimum": 0 },
              "unit_name": { "type": ["string", "null"] },
              "monthly_credit_usd": { "type": ["number", "null"], "minimum": 0 },
              "monthly_requests": { "type": ["number", "null"], "minimum": 0 },
              "notes_fa": { "type": ["string", "null"] }
            }
          }
        },
        "notes_fa": { "type": "string" }
      }
    },
    "iran_access": {
      "type": "object",
      "additionalProperties": false,
      "required": ["status", "official_policy", "tested_from_iran", "tested_at", "test_method", "network", "evidence"],
      "properties": {
        "status": { "enum": ["verified_working", "verified_working_vpn", "direct_blocked_vpn_working", "verified_blocked", "officially_unsupported", "intermittent", "signup_blocked", "unknown"] },
        "official_policy": { "enum": ["supported", "unsupported", "not_documented", "unknown"] },
        "tested_from_iran": { "type": "boolean" },
        "tested_at": { "type": ["string", "null"], "format": "date" },
        "test_method": { "enum": ["live_request", "connectivity_probe", "signup_only", "community_report", "official_docs", "not_tested"] },
        "network": {
          "type": ["object", "null"],
          "additionalProperties": false,
          "properties": {
            "country": { "type": ["string", "null"], "pattern": "^[A-Z]{2}$" },
            "isp": { "type": ["string", "null"] },
            "asn": { "type": ["string", "null"] },
            "city": { "type": ["string", "null"] },
            "route": { "enum": ["direct", "vpn"] },
            "exit_country": { "type": ["string", "null"], "pattern": "^[A-Z]{2}$" },
            "vpn_provider": { "type": ["string", "null"] }
          }
        },
        "evidence": {
          "type": "array",
          "items": {
            "type": "object",
            "additionalProperties": false,
            "required": ["type"],
            "properties": {
              "type": { "enum": ["official_docs", "live_test", "connectivity_test", "community_report"] },
              "url": { "type": ["string", "null"], "format": "uri" },
              "checked_at": { "type": ["string", "null"], "format": "date" },
              "timestamp": { "type": ["string", "null"], "format": "date-time" },
              "http_status": { "type": ["integer", "null"], "minimum": 100, "maximum": 599 },
              "latency_ms": { "type": ["integer", "null"], "minimum": 0 },
              "model_tested": { "type": ["string", "null"] },
              "endpoint": { "type": ["string", "null"] },
              "source": { "type": ["string", "null"] },
              "connectivity_result": { "enum": ["http_response", "connection_refused", "timeout", "dns_failure", "tls_failure", "network_error", null] },
              "auth_method": { "type": ["string", "null"] },
              "credential_validated_from": { "type": ["string", "null"] },
              "credential_validated_status": { "type": ["integer", "null"], "minimum": 100, "maximum": 599 },
              "response_fingerprint": { "type": ["string", "null"] },
              "response_body_fingerprint": { "type": ["string", "null"] },
              "rate_limit_headers": {
                "type": ["object", "null"],
                "additionalProperties": false,
                "properties": {
                  "limit": { "type": ["string", "null"] },
                  "remaining": { "type": ["string", "null"] },
                  "reset": { "type": ["string", "null"] },
                  "retry_after": { "type": ["string", "null"] }
                }
              },
              "notes_fa": { "type": ["string", "null"] }
            },
            "allOf": [
              {
                "if": { "properties": { "type": { "const": "official_docs" } } },
                "then": { "required": ["url", "checked_at", "notes_fa"] }
              },
              {
                "if": { "properties": { "type": { "const": "community_report" } } },
                "then": { "required": ["url", "checked_at", "notes_fa"] }
              },
              {
                "if": { "properties": { "type": { "const": "live_test" } } },
                "then": { "required": ["timestamp", "http_status", "latency_ms", "model_tested", "endpoint", "source"] }
              },
              {
                "if": { "properties": { "type": { "const": "connectivity_test" } } },
                "then": { "required": ["checked_at", "endpoint", "source", "connectivity_result", "notes_fa"] }
              },
              {
                "if": {
                  "properties": {
                    "type": { "const": "connectivity_test" },
                    "connectivity_result": { "const": "http_response" }
                  },
                  "required": ["type", "connectivity_result"]
                },
                "then": { "required": ["http_status"] }
              },
              {
                "if": { "required": ["credential_validated_from"] },
                "then": { "required": ["credential_validated_status"] }
              },
              {
                "if": { "required": ["credential_validated_status"] },
                "then": { "required": ["credential_validated_from"] }
              }
            ]
          }
        },
        "notes_fa": { "type": "string" }
      }
    },
    "models": {
      "type": "object",
      "additionalProperties": false,
      "required": ["dynamic", "source", "notable"],
      "properties": {
        "dynamic": { "type": "boolean" },
        "source": { "type": ["string", "null"], "format": "uri" },
        "notable": { "type": "array", "items": { "type": "string" }, "uniqueItems": true }
      }
    },
    "verification": {
      "type": "object",
      "additionalProperties": false,
      "required": ["level", "last_checked", "checked_by", "stale_after_days"],
      "properties": {
        "level": { "enum": ["docs_verified", "live_verified", "community_report", "unverified"] },
        "last_checked": { "type": "string", "format": "date" },
        "checked_by": { "type": "string" },
        "stale_after_days": { "type": "integer", "minimum": 1 },
        "stages": {
          "type": ["object", "null"],
          "additionalProperties": false,
          "properties": {
            "documentary": { "type": "boolean" },
            "signup": { "type": "boolean" },
            "credential_issuance": { "type": "boolean" },
            "model_listing": { "type": "boolean" },
            "authenticated_inference": { "type": "boolean" },
            "metering": { "type": "boolean" },
            "iran_direct": { "type": "boolean" },
            "foreign_control": { "type": "boolean" }
          }
        }
      }
    },
    "notes_fa": { "type": "string" },
    "sources": {
      "type": "array",
      "minItems": 1,
      "uniqueItems": true,
      "items": { "type": "string", "format": "uri" }
    }
  }
}
