{
  "schema_version": "1.1.0",
  "service_type": "official_gateway",
  "id": "nvidia-nim",
  "name": "NVIDIA NIM API Catalog",
  "website": "https://build.nvidia.com/",
  "docs": "https://docs.api.nvidia.com/nim/docs/product",
  "signup": "https://developer.nvidia.com/login",
  "signup_requirements": [
    "foreign_mobile_number"
  ],
  "api": {
    "base_url": "https://integrate.api.nvidia.com/v1",
    "openai_compatible": true,
    "auth": "api_key"
  },
  "capabilities": [
    "chat",
    "text_generation",
    "reasoning",
    "embeddings",
    "tool_calling",
    "structured_output"
  ],
  "free_tier": {
    "status": "limited",
    "type": "permanent_allowance",
    "requires_payment_method": false,
    "limits": [],
    "notes_fa": "اعضای رایگان NVIDIA Developer Program برای Prototype، تحقیق، توسعه و آزمایش به Endpointهای میزبانی‌شده دسترسی دارند؛ استفاده Production نیازمند مجوز تجاری است. صفحه اصلی build.nvidia.com اعلام 'Free inference with leading models' می‌کند."
  },
  "iran_access": {
    "status": "signup_blocked",
    "official_policy": "not_documented",
    "tested_from_iran": true,
    "tested_at": "2026-07-21",
    "test_method": "connectivity_probe",
    "network": {
      "country": "IR",
      "route": "direct"
    },
    "evidence": [
      {
        "type": "connectivity_test",
        "checked_at": "2026-07-16",
        "http_status": 200,
        "endpoint": "https://integrate.api.nvidia.com/v1/models",
        "source": "IRAN_SERVER — direct connectivity probe",
        "connectivity_result": "http_response",
        "notes_fa": "Endpoint مدل‌ها از مسیر مستقیم ایران پاسخ HTTP 200 داد؛ این نتیجه Reachability را نشان می‌دهد و جای درخواست استنتاج با کلید Developer Program را نمی‌گیرد."
      },
      {
        "type": "connectivity_test",
        "checked_at": "2026-07-20",
        "http_status": 404,
        "endpoint": "https://integrate.api.nvidia.com/v1/chat/completions",
        "source": "IRAN_SERVER — direct connectivity probe",
        "connectivity_result": "http_response",
        "notes_fa": "Endpoint از ایران قابل دسترس است (HTTP 404). نیاز به API key معتبر."
      },
      {
        "type": "community_report",
        "url": "https://developer.nvidia.com/login",
        "checked_at": "2026-07-21",
        "notes_fa": "ثبت‌نام در NVIDIA Developer Program نیاز به شماره تلفن خارجی برای احراز هویت دارد. کاربر ایرانی به شماره خارجی دسترسی ندارد. کلید API قابل دریافت نیست."
      }
    ],
    "notes_fa": "Endpoint مستقیم از ایران در دسترس است؛ ثبت‌نام در NVIDIA Developer Program نیاز به شماره موبایل خارجی دارد."
  },
  "models": {
    "dynamic": true,
    "source": "https://build.nvidia.com/explore/discover",
    "notable": []
  },
  "verification": {
    "level": "live_verified",
    "last_checked": "2026-07-21",
    "checked_by": "maintainers",
    "stale_after_days": 30
  },
  "notes_fa": "این دسترسی برای Production رایگان نیست و سقف عددی ثابت عمومی در منبع بررسی‌شده اعلام نشده است. Endpoint مستقیم قابل دسترس است، اما صدور Credential نیاز به شماره موبایل خارجی دارد.",
  "sources": [
    "https://docs.api.nvidia.com/nim/docs/product",
    "https://build.nvidia.com/explore/discover"
  ]
}
