{
  "schema_version": "1.1.0",
  "service_type": "official_gateway",
  "id": "kilo-gateway",
  "name": "Kilo Gateway",
  "website": "https://kilo.ai/",
  "docs": "https://kilo.ai/docs/gateway",
  "signup": "https://app.kilo.ai/",
  "api": {
    "base_url": "https://api.kilo.ai/api/gateway",
    "openai_compatible": true,
    "auth": "none_or_api_key"
  },
  "capabilities": [
    "chat",
    "text_generation",
    "reasoning",
    "tool_calling",
    "structured_output"
  ],
  "free_tier": {
    "status": "active",
    "type": "free_models",
    "requires_payment_method": false,
    "limits": [
      {
        "scope": "IP",
        "model": "kilo-auto/free",
        "condition": "Anonymous or authenticated free-model access",
        "rph": 200,
        "notes_fa": "مدل‌های رایگان و محدودیت‌های بالادستی می‌توانند تغییر کنند."
      }
    ],
    "notes_fa": "برای مدل‌های رایگان دسترسی ناشناس هم مستند شده است؛ کلید API برای استفادهٔ پایدار و سایر مدل‌ها قابل استفاده است."
  },
  "iran_access": {
    "status": "verified_working",
    "official_policy": "not_documented",
    "tested_from_iran": true,
    "tested_at": "2026-07-16",
    "test_method": "live_request",
    "network": {
      "country": "IR",
      "route": "direct"
    },
    "evidence": [
      {
        "type": "live_test",
        "timestamp": "2026-07-16T06:01:19Z",
        "http_status": 200,
        "latency_ms": 2881,
        "model_tested": "kilo-auto/free",
        "endpoint": "https://api.kilo.ai/api/gateway/chat/completions",
        "auth_method": "anonymous",
        "source": "LOCAL_PC — Iran mobile network (MCI AS44244)",
        "notes_fa": "دسترسی ناشناس (بدون کلید API) از ایران موفق بود."
      }
    ]
  },
  "models": {
    "dynamic": true,
    "source": "https://kilo.ai/docs/gateway/models-and-providers",
    "notable": [
      "kilo-auto/free"
    ]
  },
  "verification": {
    "level": "live_verified",
    "last_checked": "2026-07-16",
    "checked_by": "maintainers",
    "stale_after_days": 14
  },
  "notes_fa": "دسترسی ناشناس مستقیم از ایران در ۲۰۲۶-۰۷-۱۶ با درخواست زنده تأیید شد. به‌دلیل فهرست پویا، مدل انتخاب‌شده در مسیر رایگان ممکن است تغییر کند.",
  "sources": [
    "https://kilo.ai/docs/gateway",
    "https://kilo.ai/docs/gateway/authentication",
    "https://kilo.ai/docs/getting-started/rate-limits-and-costs",
    "https://kilo.ai/docs/gateway/models-and-providers"
  ]
}
