{
  "schema_version": "1.1.0",
  "service_type": "official_gateway",
  "id": "agnes-ai",
  "name": "Agnes AI",
  "website": "https://agnes-ai.com/",
  "docs": "https://agnes-ai.com/doc/overview",
  "signup": "https://platform.agnes-ai.com/settings/apiKeys",
  "api": {
    "base_url": "https://apihub.agnes-ai.com/v1",
    "openai_compatible": true,
    "auth": "api_key"
  },
  "capabilities": [
    "chat",
    "text_generation",
    "reasoning",
    "tool_calling",
    "structured_output"
  ],
  "free_tier": {
    "status": "active",
    "type": "free_models",
    "requires_payment_method": null,
    "limits": [
      {
        "scope": "free/default text models",
        "model": null,
        "condition": "Actual Executable RPM; Public Request RPM is 30",
        "rpm": 20,
        "notes_fa": "ظرفیت قابل اجرای واقعی ۲۰ RPM است؛ سقف پذیرش درخواست عمومی ۳۰ RPM اعلام شده است."
      },
      {
        "scope": "free/default image models",
        "model": null,
        "condition": "1K resolution; Actual Executable RPM; Public Request RPM is 30",
        "rpm": 20,
        "notes_fa": "برای تصویر 1K ظرفیت قابل اجرای واقعی ۲۰ RPM است."
      },
      {
        "scope": "free/default image models",
        "model": null,
        "condition": "2K resolution; Actual Executable RPM; Public Request RPM is 20",
        "rpm": 10,
        "notes_fa": "برای تصویر 2K ظرفیت قابل اجرای واقعی ۱۰ RPM است."
      },
      {
        "scope": "free/default image models",
        "model": null,
        "condition": "3K resolution; Actual Executable RPM; Public Request RPM is 2",
        "rpm": 1,
        "notes_fa": "برای تصویر 3K ظرفیت قابل اجرای واقعی ۱ RPM است."
      },
      {
        "scope": "free/default image models",
        "model": null,
        "condition": "4K resolution; Actual Executable RPM; Public Request RPM is 1",
        "rpm": 1,
        "notes_fa": "برای تصویر 4K ظرفیت قابل اجرای واقعی ۱ RPM است."
      },
      {
        "scope": "free/default video models",
        "model": "agnes-video-v2.0",
        "condition": "Actual Executable RPM; Public Request RPM is 2",
        "rpm": 1,
        "notes_fa": "برای ویدئو ظرفیت قابل اجرای واقعی ۱ RPM است."
      }
    ],
    "notes_fa": "پنج مدل عمومی در خانواده‌های متن، تصویر و ویدئو مستند شده‌اند. محدودیت‌ها مقادیر مرجع جاری‌اند و تضمین دائمی نیستند. طرح رایگان نیاز به کارت بانکی ندارد؛ طرح‌های اشتراکی (Starter $4، Plus $10، Pro $50) نیازمند پرداخت هستند."
  },
  "iran_access": {
    "status": "verified_working",
    "official_policy": "not_documented",
    "tested_from_iran": true,
    "tested_at": "2026-07-21",
    "test_method": "live_request",
    "network": {
      "country": "IR",
      "route": "direct"
    },
    "evidence": [
      {
        "type": "connectivity_test",
        "checked_at": "2026-07-16",
        "http_status": 401,
        "endpoint": "https://apihub.agnes-ai.com/v1/models",
        "source": "IRAN_SERVER — direct connectivity probe",
        "connectivity_result": "http_response",
        "notes_fa": "Endpoint از مسیر مستقیم ایران پاسخ HTTP 401 داد؛ این فقط دسترسی شبکه و نیاز به احراز هویت را نشان می‌دهد، نه موفقیت API مدل."
      },
      {
        "type": "connectivity_test",
        "checked_at": "2026-07-20",
        "http_status": 401,
        "endpoint": "https://apihub.agnes-ai.com/v1/chat/completions",
        "source": "IRAN_SERVER — direct connectivity probe",
        "connectivity_result": "http_response",
        "notes_fa": "Endpoint از ایران قابل دسترس است (HTTP 401). برای تعیین وضعیت عملی، درخواست با API key معتبر لازم است."
      },
      {
        "type": "live_test",
        "timestamp": "2026-07-21T17:08:26.785Z",
        "http_status": 200,
        "latency_ms": 7291,
        "model_tested": "agnes-2.0-flash",
        "endpoint": "https://apihub.agnes-ai.com/v1/chat/completions",
        "source": "IRAN_VPS — direct authenticated inference (AS196864)",
        "credential_validated_from": "FOREIGN_SERVER (DE, Hetzner AS24940)",
        "credential_validated_status": 200,
        "notes_fa": "درخواست احراز هویت‌شده با مدل agnes-2.0-flash از مسیر مستقیم ایران با HTTP 200 پاسخ داده شد. مدل از نوع reasoning است و خروجی معنی‌دار در فیلد reasoning_content قرار گرفت. کلید API از سرور خارج (آلمان) نیز با موفقیت تأیید شد. این مدرک فقط برای ASN/مسیر تست‌شده معتبر است."
      }
    ],
    "notes_fa": "درخواست احراز هویت‌شده با مدل agnes-2.0-flash از ایران با HTTP 200 پاسخ داده است. مدل از نوع reasoning و نتیجه استنتاج در فیلد reasoning_content قرار می‌گیرد. کلید API در سرور خارج (آلمان) نیز تأیید شده است. این نتیجه فقط برای ASN مسیر تست‌شده معتبر است."
  },
  "models": {
    "dynamic": true,
    "source": "https://github.com/AgnesAI-Labs/AgnesAI-Models/blob/main/MODEL_CATALOG.md",
    "notable": [
      "agnes-2.0-flash",
      "agnes-1.5-flash",
      "agnes-image-2.0-flash",
      "agnes-image-2.1-flash",
      "agnes-video-v2.0"
    ]
  },
  "verification": {
    "level": "live_verified",
    "last_checked": "2026-07-21",
    "checked_by": "maintainers",
    "stale_after_days": 30
  },
  "notes_fa": "اسناد رسمی Agnes میان Public Request RPM و Actual Executable RPM تفاوت می‌گذارند؛ Catalog مقدار قابل اجرای واقعی را ثبت می‌کند. Context window 256K و max output 64K بر اساس مستندات 2026-06-28 تأیید شده است. طرح‌های اشتراکی (Starter $4، Plus $10، Pro $50) با سهمیه‌های مشخص در مستندات رسمی اضافه شده‌اند.",
  "sources": [
    "https://agnes-ai.com/doc/overview",
    "https://github.com/AgnesAI-Labs/AgnesAI-Models/blob/main/README.md",
    "https://github.com/AgnesAI-Labs/AgnesAI-Models/blob/main/MODEL_CATALOG.md",
    "https://github.com/AgnesAI-Labs/AgnesAI-Models/blob/main/docs/FAQ.md",
    "https://github.com/AgnesAI-Labs/AgnesAI-Models/blob/main/docs/TOKEN_PLAN_FAQ.md",
    "https://github.com/AgnesAI-Labs/AgnesAI-Models/blob/main/docs/TROUBLESHOOTING.md",
    "https://github.com/AgnesAI-Labs/AgnesAI-Models/blob/main/CHANGELOG.md",
    "https://github.com/AgnesAI-Labs/AgnesAI-Models/blob/main/SUPPORT.md"
  ]
}
