{
  "schema_version": "1.1.0",
  "service_type": "official_gateway",
  "id": "fireworks-ai",
  "name": "Fireworks AI",
  "website": "https://fireworks.ai/",
  "docs": "https://docs.fireworks.ai/",
  "signup": "https://app.fireworks.ai/login",
  "api": {
    "base_url": "https://api.fireworks.ai/inference/v1",
    "openai_compatible": true,
    "auth": "api_key"
  },
  "capabilities": [
    "chat",
    "text_generation",
    "reasoning",
    "embeddings",
    "tool_calling",
    "structured_output"
  ],
  "free_tier": {
    "status": "limited",
    "type": "one_time_credit",
    "requires_payment_method": false,
    "limits": [
      {
        "scope": "new self-serve account",
        "condition": "initial promotional credit; policy may change",
        "notes_fa": "طبق صفحه رسمی قیمت‌گذاری، کاربر جدید با ۱ دلار اعتبار اولیه شروع می‌کند. این اعتبار ماهانه نیست؛ پس از اتمام آن برای ادامه استفاده باید اعتبار اضافه شود و روش پرداخت لازم است."
      },
      {
        "scope": "account-wide request limit — no payment method or no credits",
        "condition": "fixed account-wide ceiling",
        "rpm": 10,
        "notes_fa": "بدون روش پرداخت یا بدون اعتبار، سقف سراسری حساب ۱۰ درخواست در دقیقه است."
      },
      {
        "scope": "account-wide request limit — payment method and active credits",
        "condition": "fixed account-wide maximum",
        "rpm": 6000,
        "notes_fa": "با روش پرداخت و اعتبار فعال، سقف سراسری حساب تا ۶٬۰۰۰ درخواست در دقیقه است؛ این سقف از محدودیت‌های تطبیقی TPM در Serverless جداست."
      },
      {
        "scope": "serverless default total prompt",
        "condition": "adaptive per account and model; default ceiling",
        "tpm": 21600000,
        "notes_fa": "سقف پیش‌فرض Total Prompt TPM در Serverless است و با الگوی مصرف و Spending Tier می‌تواند تغییر کند."
      },
      {
        "scope": "serverless default uncached prompt",
        "condition": "adaptive per account and model; default ceiling",
        "tpm": 5400000,
        "notes_fa": "سقف پیش‌فرض Uncached Prompt TPM در Serverless است و مقدار مؤثر حساب می‌تواند تغییر کند."
      },
      {
        "scope": "serverless default generated",
        "condition": "adaptive per account and model; default ceiling",
        "tpm": 216000,
        "notes_fa": "سقف پیش‌فرض Generated TPM در Serverless است و مقدار مؤثر حساب می‌تواند تغییر کند."
      }
    ],
    "notes_fa": "Fireworks برای حساب‌های self-serve از سیستم اعتبار پیش‌پرداخت استفاده می‌کند. کاربر جدید طبق منبع رسمی ۱ دلار اعتبار اولیه دریافت می‌کند. اگر موجودی به صفر برسد و Auto Reload فعال نباشد، استفاده متوقف می‌شود تا اعتبار اضافه شود. برای ادامه پس از پایان اعتبار اولیه، روش پرداخت لازم است."
  },
  "iran_access": {
    "status": "signup_blocked",
    "official_policy": "not_documented",
    "tested_from_iran": true,
    "tested_at": "2026-07-22",
    "test_method": "connectivity_probe",
    "network": {
      "country": "IR",
      "route": "direct"
    },
    "evidence": [
      {
        "type": "live_test",
        "timestamp": "2026-07-16T11:51:38.762Z",
        "http_status": 403,
        "latency_ms": 500,
        "model_tested": "gpt-oss-120b",
        "endpoint": "https://api.fireworks.ai/inference/v1/chat/completions",
        "source": "IRAN_VPS — direct",
        "credential_validated_from": "FOREIGN_SERVER",
        "credential_validated_status": 412,
        "notes_fa": "کلید از ایران ۴۰۳ و از مسیر غیرایرانی ۴۱۲ برگرداند؛ به‌دلیل تعلیق حساب، اعتبار Credential و Geo-block قابل تفکیک نیست."
      },
      {
        "type": "connectivity_test",
        "checked_at": "2026-07-16",
        "endpoint": "https://api.fireworks.ai/inference/v1/models",
        "source": "IRAN_VPS — direct connectivity probe",
        "connectivity_result": "connection_refused",
        "notes_fa": "یک Probe از مسیر مستقیم ایران پیش از دریافت پاسخ HTTP با Connection refused شکست خورد؛ این نتیجه می‌تواند ناشی از Routing، Firewall یا وضعیت موقت سرویس باشد و به‌تنهایی اثبات انسداد جغرافیایی نیست."
      },
      {
        "type": "connectivity_test",
        "checked_at": "2026-07-20",
        "endpoint": "https://api.fireworks.ai/inference/v1/chat/completions",
        "source": "IRAN_VPS — direct connectivity probe",
        "connectivity_result": "timeout",
        "notes_fa": "اتصال به api.fireworks.ai از ایران با Timeout ۱۵ ثانیه‌ای مواجه شد. هیچ پاسخی دریافت نشد. این تنها یک Probe شبکه است و برای تأیید مسدودیت به تست با API key معتبر نیاز است."
      },
      {
        "type": "live_test",
        "timestamp": "2026-07-21T17:00:00.000Z",
        "http_status": 404,
        "latency_ms": 12000,
        "model_tested": "accounts/fireworks/models/gpt-oss-120b",
        "endpoint": "https://api.fireworks.ai/inference/v1/chat/completions",
        "source": "FOREIGN_SERVER (DE, Hetzner AS24940)",
        "credential_validated_from": "DIRECT_ATTEMPT",
        "credential_validated_status": 404,
        "notes_fa": "از سرور خارج (آلمان) درخواست با کلید موجود فرستاده شد. حساب آزمایشی معلق است (محدودیت مصرف یا صورت‌حساب پرداخت‌نشده). مدل‌ها قابل لیست نیستند (0 مدل). استنتاج با 404 رد شد. وضعیت شبکه از ایران همچنان Timeout است، اما به‌دلیل تعلیق حساب، نمی‌توان نتیجه گرفت که مسدودیت ایران ناشی از Geo-blocking است."
      },
      {
        "type": "live_test",
        "timestamp": "2026-07-21T17:50:00.000Z",
        "http_status": 403,
        "latency_ms": 3500,
        "model_tested": "accounts/fireworks/models/gpt-oss-120b",
        "endpoint": "https://api.fireworks.ai/inference/v1/chat/completions",
        "source": "FOREIGN_SERVER (DE, Hetzner AS24940)",
        "credential_validated_from": "FOREIGN_SERVER (DE, Hetzner AS24940)",
        "credential_validated_status": 403,
        "notes_fa": "حساب جدید Fireworks از سرور خارج (آلمان) تست شد و همه endpointها خطای ۴۰۳ با علت sanitized_origin_country برگرداندند. حساب در زمان ثبت‌نام (احتمالاً به دلیل IP ایران) مسدود شده است. این محدودیت در سطح حساب است و به IP درخواست‌دهنده مربوط نیست."
      },
      {
        "type": "connectivity_test",
        "checked_at": "2026-07-22",
        "latency_ms": 934,
        "endpoint": "https://api.fireworks.ai/inference/v1/chat/completions",
        "source": "IRAN_VPS — direct connectivity probe",
        "connectivity_result": "network_error",
        "notes_fa": "Probe مستقیم از ایران پیش از دریافت پاسخ HTTP با network_error شکست خورد. این نتیجه فقط شکست شبکه در مسیر آزمایش‌شده را ثبت می‌کند و به‌تنهایی مسدودیت جغرافیایی یا وضعیت Credential را اثبات نمی‌کند."
      },
      {
        "type": "live_test",
        "timestamp": "2026-07-22T20:06:44.658Z",
        "http_status": 404,
        "latency_ms": 461,
        "model_tested": "gpt-oss-120b",
        "endpoint": "https://api.fireworks.ai/inference/v1/chat/completions",
        "source": "FOREIGN_SERVER (DE)",
        "notes_fa": "درخواست از مسیر مستقیم آلمان HTTP 404 دریافت کرد. این پاسخ به‌تنهایی وضعیت Credential، حساب یا مدل را اثبات نمی‌کند؛ نتیجه فقط با Dashboard رسمی یا پاسخ مستند Provider قابل تعیین است."
      }
    ],
    "notes_fa": "ثبت‌نام با حساب آزمایش‌شده به محدودیت سطح حساب منتهی شد. مسیر مستقیم ایران نیز در چند Probe با Timeout، Connection refused یا network_error شکست خورده است. به‌دلیل نبود یک Credential کنترل‌شده و موفق، این نتایج نباید به‌عنوان اثبات قطعی Geo-blocking یا ابطال Credential تفسیر شوند."
  },
  "models": {
    "dynamic": true,
    "source": "https://fireworks.ai/models",
    "notable": [
      "llama-3.3-70b",
      "gpt-oss-120b",
      "deepseek-v4-flash",
      "qwen3-7b-plus",
      "gemma-3n-4b"
    ]
  },
  "verification": {
    "level": "live_verified",
    "last_checked": "2026-08-07",
    "checked_by": "maintainers",
    "stale_after_days": 14
  },
  "notes_fa": "بازبینی ۲۰۲۶-۰۸-۰۷ فقط مستندات رسمی Billing، اعتبار و Rate Limit را تازه کرد. وضعیت Credential، حساب و دسترسی ایران دوباره تست نشد و Evidence تاریخ‌دار قبلی بدون تغییر معنایی حفظ شده است.",
  "sources": [
    "https://fireworks.ai/pricing",
    "https://docs.fireworks.ai/getting-started/quickstart",
    "https://docs.fireworks.ai/guides/quotas_usage/account-quotas",
    "https://docs.fireworks.ai/serverless/rate-limits",
    "https://docs.fireworks.ai/faq-new/billing-pricing/what-happens-when-i-finish-my-1-dollar-credit"
  ]
}
