{
  "schema_version": "1.1.0",
  "service_type": "community_gateway",
  "id": "freetheai",
  "name": "FreeTheAI",
  "website": "https://freetheai.xyz/",
  "docs": "https://freetheai.xyz/docs",
  "signup": "https://freetheai.xyz/",
  "signup_requirements": [
    "foreign_mobile_number"
  ],
  "api": {
    "base_url": "https://api.freetheai.xyz/v1",
    "openai_compatible": true,
    "auth": "api_key"
  },
  "capabilities": [
    "chat",
    "text_generation",
    "reasoning",
    "tool_calling",
    "structured_output",
    "image_generation"
  ],
  "free_tier": {
    "status": "active",
    "type": "free_models",
    "requires_payment_method": false,
    "limits": [
      {
        "scope": "account",
        "model": null,
        "condition": "Tier 1 after Discord signup",
        "rpm": 10,
        "rpd": 250,
        "concurrent_requests": 1,
        "notes_fa": "سقف روزانه پیش‌فرض برای پاسخ‌های موفق است؛ Tierهای بالاتر با فعالیت اجتماعی تا ۳۵ RPM و concurrency برابر ۳ می‌رسند."
      }
    ],
    "notes_fa": "ثبت‌نام از طریق Discord (/signup) و check-in روزانه (/checkin) الزامی است. ۶۰+ مدل فعال. مدل‌های image generation و audio نیز موجود. اسلات‌های پولی اختیاری جداگانه برای مدل‌های قوی‌تر موجود است."
  },
  "iran_access": {
    "status": "signup_blocked",
    "official_policy": "not_documented",
    "tested_from_iran": true,
    "tested_at": "2026-07-21",
    "test_method": "connectivity_probe",
    "network": {
      "country": "IR",
      "route": "direct"
    },
    "evidence": [
      {
        "type": "connectivity_test",
        "checked_at": "2026-07-16",
        "http_status": 200,
        "endpoint": "https://api.freetheai.xyz/v1/health",
        "source": "IRAN_SERVER — direct connectivity probe",
        "connectivity_result": "http_response",
        "notes_fa": "Health endpoint از مسیر مستقیم ایران پاسخ HTTP 200 داد؛ این نتیجه فقط Reachability را ثابت می‌کند و جای درخواست مدل با کلید Discord را نمی‌گیرد."
      },
      {
        "type": "connectivity_test",
        "checked_at": "2026-07-20",
        "http_status": 401,
        "endpoint": "https://api.freetheai.xyz/v1/chat/completions",
        "source": "IRAN_SERVER — direct connectivity probe",
        "connectivity_result": "http_response",
        "notes_fa": "Endpoint از ایران قابل دسترس است (HTTP 401). نیاز به API key معتبر."
      },
      {
        "type": "community_report",
        "url": "https://support.discord.com/hc/en-us/articles/360017947012-Phone-Verification",
        "checked_at": "2026-07-21",
        "notes_fa": "ورود به Discord با اکانت جدید امکان‌پذیر است. اما برای دریافت کلید API از ربات FreeTheAI در دیسکورد، احراز هویت با شماره تلفن الزامی است. کاربر ایرانی به شماره خارجی دسترسی ندارد. در نتیجه کلید قابل دریافت نیست."
      }
    ],
    "notes_fa": "Endpoint از ایران قابل دسترس است. ورود به Discord ممکن است اما صدور کلید نیاز به شماره تلفن خارجی دارد."
  },
  "models": {
    "dynamic": true,
    "source": "https://freetheai.xyz/models",
    "notable": [
      "opc/deepseek-v4-flash-free",
      "glm/glm-5.1",
      "kai/qwen3.5-32b",
      "eve/gpt-image-2"
    ]
  },
  "verification": {
    "level": "live_verified",
    "last_checked": "2026-08-05",
    "checked_by": "maintainers",
    "stale_after_days": 14
  },
  "notes_fa": "این سرویس یک Gateway اجتماعی است، نه Provider اصلی مدل. پایداری، قوانین و ظرفیت آن باید مستقل از Providerهای رسمی پایش شود. Endpoint مستقیم در دسترس است؛ پیش‌نیاز حساب برای صدور کلید، شماره موبایل خارجی است.",
  "sources": [
    "https://github.com/Free-The-Ai/free-ai",
    "https://freetheai.xyz/docs",
    "https://freetheai.xyz/models",
    "https://github.com/vibheksoni/free-ai"
  ]
}
