{
  "schema_version": "1.1.0",
  "service_type": "community_gateway",
  "id": "llm7-io",
  "name": "LLM7.io",
  "website": "https://llm7.io/",
  "docs": "https://docs.llm7.io/quickstart",
  "signup": "https://dash.llm7.io/",
  "api": {
    "base_url": "https://api.llm7.io/v1",
    "openai_compatible": true,
    "auth": "none_or_api_key"
  },
  "capabilities": [
    "chat",
    "text_generation",
    "reasoning",
    "image_generation",
    "json_mode"
  ],
  "free_tier": {
    "status": "active",
    "type": "free_models",
    "requires_payment_method": false,
    "limits": [
      {
        "scope": "anonymous",
        "condition": "no registration, use 'unused' as API key",
        "rpm": 30,
        "notes_fa": "۳۰ RPM ناشناس (با کلید 'unused'). با توکن dash.llm7.io: محدودیت بالاتر. ۳۰+ مدل. مدل‌سلکتورها: default، fast، pro."
      }
    ],
    "notes_fa": "دروازه API با اصطکاک صفر. بدون نیاز به ثبت‌نام برای دسترسی پایه با کلید 'unused'. ۳۰+ مدل. سلفکتورهای مدل: default (عمومی)، fast (سرعت بالا)، pro (پولی). تصویرسازی با gpt-image-2."
  },
  "iran_access": {
    "status": "verified_working",
    "official_policy": "not_documented",
    "tested_from_iran": true,
    "tested_at": "2026-07-16",
    "test_method": "live_request",
    "network": {
      "country": "IR",
      "route": "direct"
    },
    "evidence": [
      {
        "type": "live_test",
        "timestamp": "2026-07-16T10:15:00Z",
        "http_status": 200,
        "latency_ms": 560,
        "model_tested": "codestral-latest",
        "endpoint": "https://api.llm7.io/v1/chat/completions",
        "auth_method": "anonymous",
        "source": "LOCAL_PC — Iran direct",
        "notes_fa": "دسترسی ناشناس با مدل codestral-latest موفق بود. برخی مدل‌ها (deepseek-v4-flash, gpt-5.4-mini) نیاز به API Key دارند."
      }
    ],
    "notes_fa": "دسترسی ناشناس از ایران با مدل codestral-latest تأیید شد. برخی مدل‌ها نیاز به API Key دارند."
  },
  "models": {
    "dynamic": true,
    "source": "https://api.llm7.io/v1/models",
    "notable": [
      "default",
      "fast",
      "pro",
      "gpt-5.4",
      "gpt-5.5",
      "gpt-5.6-luna",
      "codestral-latest",
      "deepseek-v4-flash",
      "claude-sonnet-5",
      "gpt-image-2"
    ]
  },
  "verification": {
    "level": "live_verified",
    "last_checked": "2026-08-05",
    "checked_by": "maintainers",
    "stale_after_days": 14
  },
  "sources": [
    "https://docs.llm7.io/quickstart",
    "https://docs.llm7.io/guides/models",
    "https://dash.llm7.io/"
  ]
}
