{
  "schema_version": "1.1.0",
  "service_type": "official_gateway",
  "id": "siliconflow",
  "name": "SiliconFlow",
  "website": "https://cloud.siliconflow.cn/",
  "docs": "https://cloud.siliconflow.cn/account/ak",
  "signup": "https://cloud.siliconflow.cn/account/ak",
  "signup_requirements": [
    "foreign_mobile_number"
  ],
  "api": {
    "base_url": "https://api.siliconflow.cn/v1",
    "openai_compatible": true,
    "auth": "api_key"
  },
  "capabilities": [
    "chat",
    "text_generation",
    "reasoning",
    "tool_calling",
    "structured_output"
  ],
  "free_tier": {
    "status": "active",
    "type": "free_models",
    "requires_payment_method": false,
    "limits": [
      {
        "scope": "account",
        "condition": "phone verification (Chinese number)",
        "rpm": 30,
        "tpm": 60000,
        "notes_fa": "۳۰ RPM · ۶۰K TPM. نیاز به تأیید شماره تلفن چینی. ۲۰۰+ مدل پولی نیز موجود است."
      }
    ],
    "notes_fa": "Provider چینی با مدل‌های رایگان دائمی. Qwen3-8B و DeepSeek-R1-Distill-Qwen-7B رایگان. دریافت کلید نیاز به شماره موبایل خارجی (+86) دارد."
  },
  "iran_access": {
    "status": "signup_blocked",
    "official_policy": "not_documented",
    "tested_from_iran": true,
    "tested_at": "2026-07-16",
    "test_method": "connectivity_probe",
    "network": {
      "country": "IR",
      "route": "direct"
    },
    "evidence": [
      {
        "type": "official_docs",
        "url": "https://cloud.siliconflow.cn/account/ak",
        "checked_at": "2026-07-16",
        "notes_fa": "ثبت‌نام نیاز به تأیید شماره تلفن چینی (+86) دارد."
      },
      {
        "type": "connectivity_test",
        "checked_at": "2026-07-16",
        "http_status": 401,
        "endpoint": "https://api.siliconflow.cn/v1/models",
        "source": "IRAN_SERVER — direct connectivity probe",
        "connectivity_result": "http_response",
        "notes_fa": "Endpoint از مسیر مستقیم ایران پاسخ HTTP 401 داد؛ پیش‌نیاز شماره تلفن مستقل از Reachability شبکه است."
      }
    ],
    "notes_fa": "Endpoint مستقیم از ایران در دسترس است؛ دریافت Credential نیاز به شماره موبایل خارجی (+86) دارد."
  },
  "models": {
    "dynamic": true,
    "source": "https://cloud.siliconflow.cn/models",
    "notable": [
      "Qwen/Qwen3-8B",
      "deepseek-ai/DeepSeek-R1-Distill-Qwen-7B",
      "Qwen/Qwen3.5-35B-A3B",
      "Pro/deepseek-ai/DeepSeek-V4-Flash"
    ]
  },
  "verification": {
    "level": "live_verified",
    "last_checked": "2026-07-20",
    "checked_by": "maintainers",
    "stale_after_days": 30
  },
  "sources": [
    "https://cloud.siliconflow.cn/",
    "https://github.com/mnfst/awesome-free-llm-apis"
  ]
}
