{
  "schema_version": "1.1.0",
  "service_type": "official_provider",
  "id": "cohere",
  "name": "Cohere",
  "website": "https://cohere.com/",
  "docs": "https://docs.cohere.com/docs/rate-limits",
  "signup": "https://dashboard.cohere.com/welcome/register",
  "api": {
    "base_url": "https://api.cohere.com/v2",
    "openai_compatible": false,
    "auth": "api_key"
  },
  "capabilities": [
    "chat",
    "text_generation",
    "reasoning",
    "embeddings",
    "tool_calling",
    "structured_output"
  ],
  "free_tier": {
    "status": "trial",
    "type": "trial",
    "requires_payment_method": false,
    "limits": [
      {
        "scope": "trial key chat models",
        "model": null,
        "condition": "evaluation/non-production key",
        "rpm": 20,
        "monthly_requests": 1000,
        "notes_fa": "برخی Endpointها محدودیت دقیقه‌ای متفاوت دارند."
      }
    ],
    "notes_fa": "کلید Trial رایگان و محدود به ارزیابی است؛ سقف کلی ۱۰۰۰ فراخوانی در ماه اعلام شده است."
  },
  "iran_access": {
    "status": "verified_blocked",
    "official_policy": "not_documented",
    "tested_from_iran": true,
    "tested_at": "2026-07-16",
    "test_method": "live_request",
    "network": {
      "country": "IR",
      "route": "direct"
    },
    "evidence": [
      {
        "type": "live_test",
        "timestamp": "2026-07-15T21:15:11Z",
        "http_status": 403,
        "latency_ms": 2440,
        "model_tested": "command-a-03-2025",
        "endpoint": "https://api.cohere.com/v2/chat",
        "source": "LOCAL_PC — Iran fixed network",
        "notes_fa": "403 بدون کلمه کلیدی منطقه‌ای. برای تأیید Geo-block نیاز به اعتبارسنجی همان کلید از منطقه مجاز است."
      },
      {
        "type": "live_test",
        "timestamp": "2026-07-16T06:01:19Z",
        "http_status": 403,
        "latency_ms": 1243,
        "model_tested": "command-a-03-2025",
        "endpoint": "https://api.cohere.com/v2/chat",
        "credential_validated_from": "DE (v2rayN proxy)",
        "credential_validated_status": 200,
        "source": "LOCAL_PC — Iran mobile network (MCI AS44244)",
        "notes_fa": "همان کلید API از ایران 403 و از آلمان (پروکسی) 200 برگرداند. مسدودیت جغرافیایی تأیید شد."
      }
    ]
  },
  "models": {
    "dynamic": true,
    "source": "https://docs.cohere.com/docs/models",
    "notable": [
      "command-a-03-2025"
    ]
  },
  "verification": {
    "level": "live_verified",
    "last_checked": "2026-07-16",
    "checked_by": "maintainers",
    "stale_after_days": 30
  },
  "notes_fa": "Trial برای Production در نظر گرفته نشده و باید جدا از Free Tier دائمی نمایش داده شود.",
  "sources": [
    "https://docs.cohere.com/docs/rate-limits",
    "https://docs.cohere.com/docs/how-does-cohere-pricing-work"
  ]
}
