{
  "schema_version": "1.1.0",
  "service_type": "official_gateway",
  "id": "opencode-zen",
  "name": "OpenCode Zen",
  "website": "https://opencode.ai/zen",
  "docs": "https://opencode.ai/docs/zen",
  "signup": "https://opencode.ai",
  "api": {
    "base_url": "https://opencode.ai/zen/v1",
    "openai_compatible": true,
    "auth": "api_key"
  },
  "capabilities": [
    "chat",
    "text_generation",
    "reasoning",
    "tool_calling",
    "structured_output"
  ],
  "free_tier": {
    "status": "active",
    "type": "free_models",
    "requires_payment_method": true,
    "limits": [
      {
        "scope": "account",
        "condition": "requires billing details for API key; 5 models free for limited time",
        "notes_fa": "ثبت‌نام و افزودن اطلاعات صورتحساب (کارت بانکی) الزامی است. ۵ مدل رایگان با مدت محدود. مدل‌های رایگان ممکن است داده را برای بهبود جمع‌آوری کنند."
      }
    ],
    "notes_fa": "پلتفرم OpenCode با ۵ مدل رایگان مدت‌محدود: Big Pickle، DeepSeek V4 Flash Free، MiMo-V2.5 Free، North Mini Code Free، Nemotron 3 Ultra Free. برای دریافت API Key باید اطلاعات صورتحساب اضافه کرد. مدل‌های رایگان ممکن است پس از دوره محدود حذف یا پولی شوند."
  },
  "iran_access": {
    "status": "verified_working",
    "official_policy": "not_documented",
    "tested_from_iran": true,
    "tested_at": "2026-07-16",
    "test_method": "live_request",
    "network": {
      "country": "IR",
      "route": "direct"
    },
    "evidence": [
      {
        "type": "live_test",
        "timestamp": "2026-07-16T11:51:38.762Z",
        "http_status": 200,
        "latency_ms": 500,
        "model_tested": "deepseek-v4-flash-free",
        "endpoint": "https://opencode.ai/zen/v1/chat/completions",
        "auth_method": "api_key",
        "source": "LOCAL_PC — Iran direct",
        "credential_validated_from": "AUTOMATION_SERVER",
        "credential_validated_status": 200,
        "notes_fa": "دسترسی مستقیم از ایران با کلید API موفق بود. اعتبارسنجی از سرور خارج نیز موفق."
      }
    ],
    "notes_fa": "دسترسی مستقیم از ایران با کلید API موفق بود."
  },
  "models": {
    "dynamic": true,
    "source": "https://opencode.ai/zen/v1/models",
    "notable": [
      "deepseek-v4-flash-free",
      "mimo-v2.5-free",
      "north-mini-code-free",
      "nemotron-3-ultra-free",
      "big-pickle",
      "ling-3.0-flash-free",
      "laguna-s-2.1-free",
      "longcat-2.0-free"
    ]
  },
  "verification": {
    "level": "live_verified",
    "last_checked": "2026-08-05",
    "checked_by": "maintainers",
    "stale_after_days": 14
  },
  "sources": [
    "https://opencode.ai/docs/zen/",
    "https://opencode.ai/zen",
    "https://github.com/anomalyco/opencode"
  ]
}
