{
  "schema_version": "1.1.0",
  "service_type": "official_gateway",
  "id": "modelscope",
  "name": "ModelScope (Alibaba)",
  "website": "https://modelscope.cn/",
  "docs": "https://modelscope.cn/my/myaccesstoken",
  "signup": "https://modelscope.cn/my/myaccesstoken",
  "api": {
    "base_url": "https://api-inference.modelscope.cn/v1",
    "openai_compatible": true,
    "auth": "api_key"
  },
  "capabilities": [
    "chat",
    "text_generation",
    "reasoning",
    "tool_calling",
    "structured_output"
  ],
  "free_tier": {
    "status": "active",
    "type": "free_models",
    "requires_payment_method": false,
    "limits": [
      {
        "scope": "account",
        "condition": "Alibaba Cloud account + real-name verification",
        "rpd": 2000,
        "notes_fa": "۲,۰۰۰ RPD کل. حداکثر ۲۰۰ RPD per model (پیش‌فرض). برخی مدل‌های بزرگ ۱۰۰ RPD. محدودیت‌ها پویا هستند و ممکن است تغییر کنند."
      }
    ],
    "notes_fa": "پلتفرم چینی API-Inference رایگان. ۵۴+ مدل: DeepSeek-V4، Qwen3.5-397B، GLM-5.2، Kimi-K2.5 و غیره. نیاز به ثبت‌نام و احراز هویت. محدودیت per-model پویا و معمولاً ۱۰۰-۲۰۰ RPD."
  },
  "iran_access": {
    "status": "signup_blocked",
    "official_policy": "not_documented",
    "tested_from_iran": true,
    "tested_at": "2026-07-16",
    "test_method": "connectivity_probe",
    "network": {
      "country": "IR",
      "route": "direct"
    },
    "evidence": [
      {
        "type": "official_docs",
        "url": "https://modelscope.cn/my/myaccesstoken",
        "checked_at": "2026-07-16",
        "notes_fa": "ثبت‌نام نیاز به حساب Alibaba Cloud و احراز هویت واقعی (شماره ملی چین یا پاسپورت) دارد."
      },
      {
        "type": "connectivity_test",
        "checked_at": "2026-07-16",
        "http_status": 200,
        "endpoint": "https://api-inference.modelscope.cn/v1/models",
        "source": "IRAN_SERVER — direct connectivity probe",
        "connectivity_result": "http_response",
        "notes_fa": "Endpoint از مسیر مستقیم ایران پاسخ HTTP 200 داد؛ مانع ثبت‌نام هویتی مستقل از Reachability شبکه است."
      }
    ],
    "notes_fa": "Endpoint از ایران قابل دسترس است، اما دریافت Credential به احراز هویت موردنیاز سرویس وابسته است؛ این محدودیت بدون دورزدن کنترل هویت ثبت شده است."
  },
  "models": {
    "dynamic": true,
    "source": "https://modelscope.cn/models",
    "notable": [
      "Qwen/Qwen3.5-397B-A17B",
      "Qwen/Qwen3.5-35B-A3B",
      "deepseek-ai/DeepSeek-V4-Flash",
      "deepseek-ai/DeepSeek-V4-Pro",
      "MiniMax-M2.5",
      "MiniMax-M3",
      "GLM-4.7-Flash",
      "GLM-5.2",
      "Kimi-K2.5"
    ]
  },
  "verification": {
    "level": "live_verified",
    "last_checked": "2026-08-05",
    "checked_by": "maintainers",
    "stale_after_days": 14
  },
  "sources": [
    "https://modelscope.cn/docs/model-service/API-Inference/limits",
    "https://modelscope.cn/docs/model-service/API-Inference/intro",
    "https://modelscope.cn/"
  ]
}
