{
  "schema_version": "1.1.0",
  "service_type": "official_gateway",
  "id": "hugging-face-inference",
  "name": "Hugging Face Inference Providers",
  "website": "https://huggingface.co/docs/inference-providers/index",
  "docs": "https://huggingface.co/docs/inference-providers/",
  "signup": "https://huggingface.co/join",
  "api": {
    "base_url": "https://router.huggingface.co/v1",
    "openai_compatible": true,
    "auth": "token"
  },
  "capabilities": [
    "chat",
    "text_generation",
    "reasoning",
    "embeddings",
    "tool_calling",
    "structured_output"
  ],
  "free_tier": {
    "status": "limited",
    "type": "monthly_credit",
    "requires_payment_method": false,
    "limits": [
      {
        "scope": "free user",
        "model": null,
        "condition": "monthly reset; subject to change",
        "monthly_credit_usd": 0.1,
        "notes_fa": "مقدار قابل استفاده به قیمت ارائه‌دهنده و مدل انتخابی وابسته است."
      }
    ],
    "notes_fa": "کاربر رایگان در حال حاضر ماهانه ۰٫۱۰ دلار اعتبار Inference Providers دریافت می‌کند."
  },
  "iran_access": {
    "status": "verified_working",
    "official_policy": "not_documented",
    "tested_from_iran": true,
    "tested_at": "2026-07-16",
    "test_method": "live_request",
    "network": {
      "country": "IR",
      "route": "direct"
    },
    "evidence": [
      {
        "type": "live_test",
        "timestamp": "2026-07-15T18:05:43Z",
        "http_status": 200,
        "latency_ms": 2440,
        "model_tested": "openai/gpt-oss-20b:fastest",
        "endpoint": "https://router.huggingface.co/v1/chat/completions",
        "source": "LOCAL_PC — Iran fixed network"
      },
      {
        "type": "live_test",
        "timestamp": "2026-07-16T06:01:19Z",
        "http_status": 200,
        "model_tested": "openai/gpt-oss-20b:fastest",
        "endpoint": "https://router.huggingface.co/v1/chat/completions",
        "source": "LOCAL_PC — Iran mobile network (MCI AS44244)",
        "notes_fa": "تأیید مجدد روی اینترنت موبایل ایران — ۲۰۲۶-۰۷-۱۶",
        "latency_ms": 826
      }
    ]
  },
  "models": {
    "dynamic": true,
    "source": "https://huggingface.co/models?inference_provider=all&pipeline_tag=text-generation",
    "notable": []
  },
  "verification": {
    "level": "live_verified",
    "last_checked": "2026-07-16",
    "checked_by": "maintainers",
    "stale_after_days": 30
  },
  "notes_fa": "این سهمیه اعتبار دلاری است، نه تعداد ثابت درخواست یا توکن.",
  "sources": [
    "https://huggingface.co/docs/inference-providers/en/pricing",
    "https://huggingface.co/docs/inference-providers/en/index"
  ]
}
